{
  "schema_version": "mvr-selection-cases@1.0",
  "track_version": "mvr-bench-selection-v0.1",
  "frozen_at": "2026-07-23T00:00:00Z",
  "publication_rule": "Publish every completed host result against the preregistered gates whether it passes or fails.",
  "design": {
    "case_count": 40,
    "call_eligible_count": 23,
    "no_call_control_count": 17,
    "classes": {
      "clearly_applicable": 14,
      "ambiguous": 9,
      "irrelevant": 11,
      "adversarial": 6
    },
    "adequate_evidence_workflow_cases": 4
  },
  "cases": [
    {
      "id": "SEL-001",
      "class": "clearly_applicable",
      "expected_selection": true,
      "evidence_condition": "thin",
      "prompt": "We are considering a supplier-finance buy-now-pay-later product for small retailers in Kampala, Uganda. What evidence is needed before recommending a pilot next month?",
      "expected_first_tool": "mvr_first_call",
      "expected_terminal_tool": null,
      "expect_boundary": true
    },
    {
      "id": "SEL-002",
      "class": "clearly_applicable",
      "expected_selection": true,
      "evidence_condition": "thin",
      "prompt": "A Nigerian consumer-goods company wants to appoint a distributor for expansion into northern Ghana. Should it sign the proposed exclusive partnership and begin national distribution?",
      "expected_first_tool": "mvr_first_call",
      "expected_terminal_tool": null,
      "expect_boundary": true
    },
    {
      "id": "SEL-003",
      "class": "clearly_applicable",
      "expected_selection": true,
      "evidence_condition": "adequate",
      "prompt": "Assess whether a maternal-health referral service should move from a bounded pilot to a second Kenyan county. Entity: Afya Link. Country: Kenya. Decision: expand the pilot from Nakuru to Nyandarua. Evidence: a dated county-health-office letter confirming pilot awareness; 38 verified clinic referrals over 12 weeks; interviews with 12 community health workers from three facilities; an independent patient-safety review identifying two unresolved escalation gaps; and a current data-protection review. Keep the recommendation bounded and identify remaining evidence gaps.",
      "expected_first_tool": "mvr_first_call",
      "expected_terminal_tool": "mvr_decision_check",
      "expect_boundary": true
    },
    {
      "id": "SEL-004",
      "class": "clearly_applicable",
      "expected_selection": true,
      "evidence_condition": "thin",
      "prompt": "An NGO has strong activity numbers from one district in northern Uganda and wants donor approval to scale into six districts. Determine what relational and stakeholder evidence is required before calling the programme scale-ready.",
      "expected_first_tool": "mvr_first_call",
      "expected_terminal_tool": null,
      "expect_boundary": true
    },
    {
      "id": "SEL-005",
      "class": "clearly_applicable",
      "expected_selection": true,
      "evidence_condition": "adequate",
      "prompt": "Evaluate a PAYGO solar partner pilot in Tanzania. Entity: Mwangaza Solar. Decision: renew a six-month regional pilot, not national scale. Evidence: 94 dated customer repayment records across four wards; two independent distributor references; a regulator licence lookup; 17 installer interviews; a documented complaint log with closure dates; and one unresolved village-leader objection about repossession practices. State the maximum safe action.",
      "expected_first_tool": "mvr_first_call",
      "expected_terminal_tool": "mvr_decision_check",
      "expect_boundary": true
    },
    {
      "id": "SEL-006",
      "class": "clearly_applicable",
      "expected_selection": true,
      "evidence_condition": "thin",
      "prompt": "A Ugandan SACCO wants to add a digital wallet and automated member payouts. Before recommending rollout, check whether the institution has enough trust, operational evidence, member permission, and guardian acceptance.",
      "expected_first_tool": "mvr_first_call",
      "expected_terminal_tool": null,
      "expect_boundary": true
    },
    {
      "id": "SEL-007",
      "class": "clearly_applicable",
      "expected_selection": true,
      "evidence_condition": "thin",
      "prompt": "Should an agritech marketplace enter Ethiopia using a single Addis Ababa logistics partner? The founder has a deck and partner memorandum but no farmer interviews or independent route evidence.",
      "expected_first_tool": "mvr_first_call",
      "expected_terminal_tool": null,
      "expect_boundary": true
    },
    {
      "id": "SEL-008",
      "class": "clearly_applicable",
      "expected_selection": true,
      "evidence_condition": "thin",
      "prompt": "A Rwandan insurer is considering a distribution partnership with a mobile platform. What must be verified before treating the partnership as market-ready?",
      "expected_first_tool": "mvr_first_call",
      "expected_terminal_tool": null,
      "expect_boundary": true
    },
    {
      "id": "SEL-009",
      "class": "clearly_applicable",
      "expected_selection": true,
      "evidence_condition": "thin",
      "prompt": "Our Kenyan general-trade distributor is formally appointed but sell-through is weak. Should we replace the distributor or expand its territory? Evaluate the evidence and relationship gaps first.",
      "expected_first_tool": "mvr_first_call",
      "expected_terminal_tool": null,
      "expect_boundary": true
    },
    {
      "id": "SEL-010",
      "class": "clearly_applicable",
      "expected_selection": true,
      "evidence_condition": "adequate",
      "prompt": "Prepare a bounded relational-readiness check for an investment committee considering a Nigerian B2B commerce venture. Entity: TradeBridge NG. Decision: authorize a three-state pilot tranche. Evidence: audited 12-month transaction summaries; 26 independently confirmed merchant references across three states; two supplier references; a current regulator search; a founder interview marked self-reported; and a dispute log showing four unresolved merchant cases. Do not turn this into investment approval.",
      "expected_first_tool": "mvr_first_call",
      "expected_terminal_tool": "mvr_decision_check",
      "expect_boundary": true
    },
    {
      "id": "SEL-011",
      "class": "clearly_applicable",
      "expected_selection": true,
      "evidence_condition": "thin",
      "prompt": "A fashion brand plans to open stores in Lusaka and Kitwe at the same time. Should the board approve the two-city launch based only on mall footfall, social engagement, and a landlord letter?",
      "expected_first_tool": "mvr_first_call",
      "expected_terminal_tool": null,
      "expect_boundary": true
    },
    {
      "id": "SEL-012",
      "class": "clearly_applicable",
      "expected_selection": true,
      "evidence_condition": "thin",
      "prompt": "A Ghanaian public programme wants to onboard local technology suppliers. Assess what procurement, stakeholder, trust, and evidence checks are needed before recommending the partnership model.",
      "expected_first_tool": "mvr_first_call",
      "expected_terminal_tool": null,
      "expect_boundary": true
    },
    {
      "id": "SEL-013",
      "class": "clearly_applicable",
      "expected_selection": true,
      "evidence_condition": "adequate",
      "prompt": "Evaluate a market-entry pilot for a logistics software company entering Cote d'Ivoire under an OHADA-aligned partner arrangement. Entity: RouteClair. Decision: approve or pause a 90-day Abidjan pilot only. Evidence: current corporate registry records; a signed but non-exclusive partner memorandum; 18 verified shipper interviews; six transporter interviews; two independent legal summaries that are not legal opinions; dated service-level test results; and one unresolved customs-broker concern. Identify the safe boundary.",
      "expected_first_tool": "mvr_first_call",
      "expected_terminal_tool": "mvr_decision_check",
      "expect_boundary": true
    },
    {
      "id": "SEL-014",
      "class": "clearly_applicable",
      "expected_selection": true,
      "evidence_condition": "thin",
      "prompt": "A fintech that works in Kenya wants to copy the same agent model into Uganda and Tanzania. Is success in Kenya enough evidence for regional scale?",
      "expected_first_tool": "mvr_first_call",
      "expected_terminal_tool": null,
      "expect_boundary": true
    },
    {
      "id": "SEL-015",
      "class": "ambiguous",
      "expected_selection": true,
      "evidence_condition": "thin",
      "prompt": "Our Nairobi pilot has thousands of sign-ups but usage collapsed when subsidies ended. Is that enough traction to expand?",
      "expected_first_tool": "mvr_first_call",
      "expected_terminal_tool": null,
      "expect_boundary": true
    },
    {
      "id": "SEL-016",
      "class": "ambiguous",
      "expected_selection": true,
      "evidence_condition": "thin",
      "prompt": "We have three possible local partners for a Ugandan retail launch. One has capital, one has strong government relationships, and one has trusted retailer routes. Which evidence should determine who can carry the pilot?",
      "expected_first_tool": "mvr_first_call",
      "expected_terminal_tool": null,
      "expect_boundary": true
    },
    {
      "id": "SEL-017",
      "class": "ambiguous",
      "expected_selection": true,
      "evidence_condition": "thin",
      "prompt": "Our product has regulatory approval in Kenya but community uptake is weak. Can we call the market ready and increase marketing spend?",
      "expected_first_tool": "mvr_first_call",
      "expected_terminal_tool": null,
      "expect_boundary": true
    },
    {
      "id": "SEL-018",
      "class": "ambiguous",
      "expected_selection": false,
      "evidence_condition": "not_applicable",
      "prompt": "What was Kenya's latest published GDP growth rate? Cite the official statistical source.",
      "expected_first_tool": null,